<?xml version="1.0" encoding="UTF-8"?>
<!DOCTYPE books SYSTEM "books.dtd">
<books>
	<book isbn='B001' cover='yes' cd="yes" tape="yes">
		<title>anta..</title>
		<author>홍길동</author> 
	    <press compno="C001">&bit; press</press> 
	    <price>2000</price>
	    <page>300</page>
	    <ebook/>
	</book>
	<book isbn='B002' cd="yes" tape='yes' lang="etc" >
		<title>anta..</title>
		<author>임꺽정</author>
		<author>일지매</author>
	    <press compno="C002">bit press</press>
	    <price>2000</price>
	    <page>300</page>
	    <paper/>
	</book>
</books>

